{
  "event_id": "00000000-0000-4000-8000-000000000105",
  "event_type": "source.version.available",
  "schema_version": "w2.source.v1",
  "aggregate_id": "00000000-0000-4000-8000-000000000101",
  "aggregate_revision": 7,
  "occurred_at": "2026-09-14T00:00:00Z",
  "payload": {
    "schema_version": "w2.source.v1",
    "source_id": "00000000-0000-4000-8000-000000000101",
    "source_version_id": "00000000-0000-4000-8000-000000000102",
    "extraction_revision_id": "00000000-0000-4000-8000-000000000103",
    "company_id": "00000000-0000-4000-8000-000000000104",
    "source_type": "job_posting",
    "url_or_path": "https://jobs.example.test/opening/synthetic",
    "title": "Synthetic Platform Engineer",
    "policy": {
      "policy_decision_id": "00000000-0000-4000-8000-000000000106",
      "official_status": "verified",
      "access_class": "public",
      "collection_permission": "allowed",
      "excerpt_storage_permission": "allowed",
      "body_storage_permission": "denied",
      "redistribution_permission": "denied",
      "checked_at": "2026-09-14T00:00:00Z",
      "policy_version": "synthetic-policy-v1"
    },
    "acquisition_status": "AVAILABLE",
    "extraction_status": "complete",
    "accuracy_status": "unverified",
    "freshness_status": "current",
    "published_at": {"status": "unknown", "raw_text": null, "value": null, "precision": null, "timezone": null},
    "collected_at": "2026-09-14T00:00:00Z",
    "checked_at": "2026-09-14T00:00:00Z",
    "valid_from": {"status": "unknown", "raw_text": null, "value": null, "precision": null, "timezone": null},
    "valid_to": {"status": "unknown", "raw_text": null, "value": null, "precision": null, "timezone": null},
    "content_hash": "aaaaaaaaaaaaaaaaaaaaaaaaaaaaaaaaaaaaaaaaaaaaaaaaaaaaaaaaaaaaaaaa",
    "hash_profile_version": "synthetic-hash-v1",
    "parser_version": "synthetic-parser-v1",
    "language": "en",
    "evidence_spans": [{
      "evidence_id": "00000000-0000-4000-8000-000000000107",
      "source_version_id": "00000000-0000-4000-8000-000000000102",
      "section_title": "Requirements",
      "text_excerpt": "Python experience",
      "locator": {"kind": "css", "value": "#requirements", "normalization_version": null, "start": null, "end": null},
      "chunk_order": 0
    }],
    "posting_sections": [{
      "section_key": "required",
      "kind": "required",
      "heading_raw": "Requirements",
      "text_raw": "Python experience",
      "evidence_ids": ["00000000-0000-4000-8000-000000000107"],
      "order": 0,
      "relation_text": null
    }],
    "retention_scope": "excerpts_only",
    "normalized_body_ref": null,
    "limitations": [],
    "metadata": {"representation": "static_html", "content_type": "text/html", "normalization_version": "synthetic-normalization-v1"}
  }
}
